dlga_start:lco_conversation_end|Eccoti qua.
dlga_fugitive_42:fugitive_52|Cosa ne vuoi sapere tu? Pensi che abbia rischiato una fuga nella notte solo per un ragazzo innamorato? Sciocco! Cose terribili accadono in quel villaggio. Cose terribili!
dlga_fugitive_52:fugitive_72|Davvero? Non vi chiedo cosa siano queste "cose", ma potete restare qui se volete.
dlga_fugitive_52:fugitive_62|Troverete qualcun altro che voglia ascoltare i vostri racconti. Io verrò via con voi!
dlga_fugitive_62:close_window|Vedo che non ho scelta ...
dlga_fugitive_72:close_window|Oh... Grazie, {mio lord/mia lady}!
dlga_member_chat:sacrificed_messenger_1|Sì, {signore/signora}?
dlga_sacrificed_messenger_1:sacrificed_messenger_2|Portate questa lettera a {s1} e dalla a {s2}.
dlga_sacrificed_messenger_1:close_window|No! Niente affatto.
dlga_sacrificed_messenger_2:sacrificed_messenger_3|Sì {signore/signora}. Vi potete fidare di me. Non fallirò.
dlga_sacrificed_messenger_3:close_window|Bene. Non dimenticherò il vostro servizio. Avrete una ricompensa al vostro ritorno.
dlga_sacrificed_messenger_3:sacrificed_messenger_cancel|Arggh! Non posso farlo. Non posso mandarvi alla morte!
dlga_sacrificed_messenger_cancel:sacrificed_messenger_cancel_2|Che volete dire {signore/signora}?
dlga_sacrificed_messenger_cancel_2:sacrificed_messenger_cancel_3|C'è una trappola pronta per voi in città. {s3} mi ha ordinato di sacrificare uno dei miei uomini scelti per ingannare il nemico, ma dovrà trovare un altro modo.
dlga_sacrificed_messenger_cancel_3:close_window|Grazie, {signore/signora}. Vi seguirò fino alle porte dell'Inferno, anche non sarà una morte piacevole, questo è certo.
dlga_start:close_window.41|Non vi preoccupiate, {signore/mia signora}, ​​conosco la strada.
dlga_start:follow_spy_talk|Bella giornata {signore/signora}. Che bel tempo, non trovate? Scusatemi, ora devo lasciarvi.
dlga_follow_spy_talk:follow_spy_talk_2|Nel nome di {s1}, siete in arresto!
dlga_follow_spy_talk_2:close_window|Non mi prenderete vivo!
dlga_follow_spy_talk:close_window|Non fate caso a me. Passavo da queste parti...
dlga_start:spy_partners_talk|Saluti.
dlga_spy_partners_talk:spy_partners_talk_2|Nel nome di {s1}, siete in arresto!
dlga_spy_partners_talk_2:close_window|Dovrete prima combatterci!
dlga_spy_partners_talk:close_window|Non fate caso a me. Passavo da queste parti...
dlga_start:runaway_serf_intro_1|Bella giornata {signore/signora}.
dlga_runaway_serf_intro_1:runaway_serf_intro_2|Sono stato mandato da {s4}, la stessa persona da cui state scappando. Non vi punirà se tornate ora.
dlga_runaway_serf_intro_2:runaway_serf_intro_3|{Mio buon signore/Mia buona signora}. Le nostre vite al villaggio di {s1} erano insopportabili. Lavoravamo tutto il giorno ed andavamo a letto ancora affamati. Stiamo andando a {s6} per iniziare una nuova vita, dove saremo trattati come esseri umani.
dlga_runaway_serf_intro_3:runaway_serf_go_back|Avete trasgredito le leggi per fuggire dal vostro feudatario. Ora tornerete al villaggio di {s1}!
dlga_runaway_serf_intro_3:runaway_serf_let_go|Bene, forse avete ragione. Tutto bene allora. Se qualcuno chiede, io non vi ho visti.
dlga_runaway_serf_go_back:close_window|Va bene {signore/signora}. Come volete. Torneremo indietro ora a {s5}.
dlga_runaway_serf_let_go:close_window|Dio vi benedica, {signore/signora}. Non dimenticheremo il vostro aiuto.
dlga_start:runaway_serf_reconsider|Buona giornata {signore/signora}! Non vi preoccupate. Se qualcuno chiede, noi non l'abbiamo veduta.
dlga_runaway_serf_reconsider:runaway_serf_go_back|Ho cambiato idea. Tornate al villaggio!
dlga_runaway_serf_reconsider:runaway_serf_let_go|Bene. Andate prima che cambi idea.
dlga_start:runaway_serf_talk_caught|Buona giornata {signore/signora}. Stavamo tornando a {s5}, ma ci siamo persi...
dlga_runaway_serf_talk_caught:runaway_serf_go_back|Non esasperate la mia pazienza. Tornate indietro, ora!
dlga_runaway_serf_talk_caught:runaway_serf_let_go|Bene, se siete ansiosi di farlo, fatelo.
dlga_start:runaway_serf_talk_again_return|Stiamo tornando a {s5} {signore/signora}.
dlga_runaway_serf_talk_again_return:runaway_serf_talk_again_return_2|Fatelo allora. Prima tornate, meglio sarà per voi.
dlga_runaway_serf_talk_again_return:runaway_serf_talk_again_return_2.1|Bene. Andate.
dlga_runaway_serf_talk_again_return_2:close_window|Sì {signore/signora}. Come volete.
dlga_start:troublesome_bandits_intro_1|Sicuramente questa dev'essere per voi una giornata sfortunata. Siamo i peggiori individui che avreste potuto incontrare da queste parti...
dlga_troublesome_bandits_intro_1:troublesome_bandits_intro_2|Heh. Per me, non siete altro che un sacco di soldi ambulante. Un mercante in {s1} mi ha offerto una bella somma per la vostra testa.
dlga_troublesome_bandits_intro_2:close_window|Un cacciatore di taglie! ... Io li odio! Ammazzate{lo/la}! Subito!
dlga_start:deserter_paid_talk|Che cosa volete? Darci altri denari?
dlga_deserter_paid_talk:deserter_paid_talk_2a|Spiacente di avervi disturbato. Devo proseguire il mio viaggio.
dlga_deserter_paid_talk_2a:close_window|Sì. Basta scherzare ora và a racimolare un po' di denari. Voglio vedervi con la borsa piena la prossima volta che v'incontro.
dlga_deserter_paid_talk:deserter_paid_talk_2b|No. È tempo che mi paghiate.
dlga_deserter_paid_talk_2b:close_window|Che sciocchezze state dicendo? Volete avere guai? Con me li avrete!
dlga_start:deserter_talk|Siamo uomini liberi. Combatteremo soltanto per noi stessi d'ora in avanti. Ora dateci il vostro oro o assaggerete il nostro acciaio!
dlga_deserter_talk:close_window|Dopo ciò che vi farò, vi pentirete d'essere fuggito dal vostro esercito!
dlga_deserter_talk:deserter_barter|Non c'è bisogno di combattere. Posso pagare per aver libero passaggio.
dlga_deserter_talk:deserter_recruit|Vi pagherò e vi garantirò una buona protezione se vi unirete alle mie truppe.
dlga_deserter_recruit:deserter_recruit_2|Suona come un buon affare. Per mostrarci la vostra buona volontà, Dateci {reg5} monete e ci uniremo a voi.
dlga_deserter_recruit_2:deserter_recruit_3a|Va bene ecco i vostri {reg5} denari.
dlga_deserter_recruit_2:deserter_barter_3b|Non ho tutti quei soldi con me.
dlga_deserter_recruit_3a:close_window|Ok, siamo al vostro servizio ora.
dlga_deserter_barter:deserter_barter_2|Bene. Siete intelligente. Ora, dopo aver visto il vostro bagaglio, penso che un tipo come voi possa permettersi {reg5} denari. Non vogliamo essere troppo avidi, giusto? Pagateci, poi potrete andare...
dlga_deserter_barter_2:deserter_barter_3a|Va bene ecco i vostri {reg5} denari.
dlga_deserter_barter_2:deserter_barter_3b|Non ho tutti quei soldi con me.
dlga_deserter_barter_3b:close_window|Peggio per voi. Sarete venduto agli schiavisti!
dlga_deserter_barter_3a:close_window|Beh, Non era poi così difficile vero? Andate ora.
dlga_start:tavernkeeper_talk|Salve {mio signore/mia signora}. Come posso servirvi?
dlga_tavernkeeper_pretalk:tavernkeeper_talk|Nient'altro?
dlga_tavernkeeper_talk:tavernkeeper_deliver_wine|Dovevo consegnarvi {reg9} unità di {s4}.
dlga_tavernkeeper_deliver_wine:tavernkeeper_pretalk|Finalmente! La mia scorta era quasi vuota. Ho pagato il costo del {s4} in anticipo. Bene, prendete questi {reg5} denari. Dovrebbero coprire le vostre spese. Portate i miei saluti a {s9}. Gli parlerò bene di voi la prossima volta che lo rivedo.
dlga_tavernkeeper_talk:tavernkeeper_deliver_wine_incomplete|Dovevo consegnarvi {reg9} unità di {s4}, ma ho perso del carico durante il viaggio.
dlga_tavernkeeper_deliver_wine_incomplete:tavernkeeper_pretalk|Un'imboscata da parte di banditi eh? Avete avuto fortuna ad essere ancora in vita! In ogni modo, io posso pagarvi solo {reg5} denari. Informerò {s1} di questo, visto che il mio ordine non è stato consegnato per intero, così voi, purtroppo, sarete probabilmente in debito per questo.
dlga_tavernkeeper_talk:tavernkeeper_deliver_wine_lost|Dovevo consegnarvi {reg9} unità di {s4}, ma ho perso del carico durante il viaggio.
dlga_tavernkeeper_deliver_wine_lost:tavernkeeper_pretalk|Cosa!? Stavo aspettando {s4} da settimane! Ed ora voi mi state dicendo che le avete perse? Potete essere certo che {s1} sarà informato di questo!
dlga_tavernkeeper_talk:tavernkeeper_buy_drinks|Vorrei offrire ad ogni uomo che viene qui dentro stasera, un boccale del vostro miglior {s0}.
dlga_tavernkeeper_buy_drinks:tavernkeeper_buy_drinks_2|Certamente, {mio signore/mia signora}. Credo {reg5} denari dovrebbero bastare. Cosa dovrei dire ai ragazzi?
dlga_tavernkeeper_buy_drinks_2:tavernkeeper_buy_drinks_end|Tutta la gente di {s10} conoscerà la generosità di {playername}!
dlga_tavernkeeper_buy_drinks_end:tavernkeeper_pretalk|Non preoccupatevi {s0}. Il vostro nome sarà pronunciato e festeggiato per tutta la notte!
dlga_tavernkeeper_talk:tavernkeeper_buy_drinks_troops|Vorrei comprare  per me e i miei uomini un barile della vostra birra migliore.
dlga_tavernkeeper_buy_drinks_troops:tavernkeeper_buy_drinks_troops_2|Certamente, {mio signore/mia signora}. Credo {reg5} denari dovrebbero bastare. Cosa dovrei dire ai ragazzi?
; dlga_tavernkeeper_buy_drinks_troops_2:tavernkeeper_buy_drinks_troops_end|The price is fair enough, let my men have at it.
dlga_tavernkeeper_buy_drinks_troops_end:tavernkeeper_pretalk|Non preoccupatevi {signore/mia signora}. I vostri uomini potranno godersi le loro pinte.
dlga_tavernkeeper_buy_drinks_troops_2:tavernkeeper_pretalk|Ripensandoci, lasciate stare.
dlga_tavernkeeper_buy_drinks_2:tavernkeeper_pretalk|Ripensandoci, lasciate stare.
dlga_tavernkeeper_talk:tavernkeeper_job_ask|Sapete di qualcuno in questo regno che potrebbe avere un lavoro per {un uomo/una donna} come me?
dlga_tavernkeeper_job_ask:tavernkeeper_job_search|Hmm... Vediamo, {s10} è spesso alla ricerca di mercenari per combattere le sue guerre.{s9}
dlga_tavernkeeper_job_search:tavernkeeper_job_result|Fatemici pensare...
dlga_tavernkeeper_job_result:tavernkeeper_job_search|Ho sentito che {s7} {s9}{s10}. Vi consiglio di parlare con {reg4?lei:lui}.
dlga_tavernkeeper_job_result:tavernkeeper_job_result_2|Potete trovare altri lavori, ovviamente. lords e borgomastri spesso hanno altri compiti di cui non parlano in giro. Inoltre, i villaggi qui intorno spesso hanno bisogno di aiuto, anche se è più probabile che vi paghino con una fetta di formaggio e una preghiera piuttosto che con il freddo denaro.
dlga_tavernkeeper_job_result_2:close_window|Terrò le mie orecchie aperte per cogliere altre opportunità. Vi consiglio di tornare a chiedere fra qualche tempo.
dlga_tavernkeeper_talk:close_window|Devo andare via ora.
dlga_start:ransom_broker_intro|Salute a voi, {s0}. Assomigliate a qualcuno che dovrei conoscere.
dlga_ransom_broker_intro:ransom_broker_intro_2|Perché?
dlga_ransom_broker_intro_2:ransom_broker_info_talk|Ho pagato il riscatto di molti poveri disgraziati catturati in queste guerre senza fine. Di solito lavoro tra la miniera di sale e il mercato degli schiavi sulla costa, vengo ingaggiato da chi ha 'perso' qualche parente o persona cara. Ma se durante una delle mie 'missioni di recupero' incrocio qualcuno che ha dei prigionieri... Beh, non c'è nulla di male se faccio qualche piccolo 'investimento'... E voi sembrate il tipo di persona che ha un prigioniero da vendere.
dlga_ransom_broker_info_talk:ransom_broker_families|E se le loro famiglie non possono pagare?
dlga_ransom_broker_families:ransom_broker_info_talk|Oh, allora per convincerli gli racconto qualche storia emozionante sulla vita nelle galee. Non immaginate cosa sia capace di fare una persona con la giusta motivazione! E se alla fine non tornano con un po' d'argento, c'è sempre qualche mercante di schiavi a cui servono delle braccia in più per le galee. Non posso lavorare bene con la borsa vuota, vi pare?
dlga_ransom_broker_info_talk:ransom_broker_prices|Che cosa si può ottenere per un prigioniero?
dlga_ransom_broker_prices:ransom_broker_info_talk|Varia. Ho un occhio eccellente per stimare il valore di un riscatto. Ci sono alcune piccole caratteristiche da osservare in un uomo, ad esempio se lui va a letto affamato, o cena e dorme in un letto comodo. I migliori guadagni ovviamente sono da ricercare nel riscatto di un nobile. Se mi lasciate fare il mio lavoro imparerete ad apprezzare le mie qualità nel ricercare informazioni sulle famiglie di tutto il mondo, su ogni appezzamento di terreno, araldica, discendente legale e illegittimo, o sulla situazione creditoria verso i commercianti.
dlga_ransom_broker_info_talk:ransom_broker_ransom_me|Potreste riscattarmi se ne avessi la possibilità?
dlga_ransom_broker_ransom_me:ransom_broker_info_talk|Certamente! Sono benvenuto in ogni corte. Non molti possono vantare le mie credenziali e conoscenze! Così, vi darò un consiglio... Mettete al sicuro parte del vostro denaro, in un luogo... Protetto, e comunicatelo ad un servitore fedele in modo da recuperarlo in fretta nel caso ce ne fosse bisogno.
dlga_ransom_broker_info_talk:ransom_broker_pretalk|È tutto quello che volevo sapere. Grazie.
dlga_start:ransom_broker_talk|Saluti. Se avete alcuni prigionieri, sarò felice di comprarli.
dlga_ransom_broker_pretalk:ransom_broker_talk|In ogni modo, se avete alcuni prigionieri, sarò felice di comprarli.
dlga_ransom_broker_talk:ransom_broker_sell_prisoners|Allora fareste bene a prendere la borsa dei denari. Ho giusto dei prigionieri da vendere.
dlga_ransom_broker_talk:ransom_broker_sell_prisoners_all|Voglio vendere tutti i prigionieri che ho con me.
dlga_ransom_broker_sell_prisoners_all:ransom_broker_sell_prisoners_all_2|Vediamo... Ti darò {reg0} monete per {reg1} {reg2?prigionieri:prigioniero}. Abbiamo un accordo?
dlga_ransom_broker_sell_prisoners_all_2:ransom_broker_sell_prisoners_2|Abbiamo un accordo.
dlga_ransom_broker_sell_prisoners_all_2:ransom_broker_pretalk|Lasciami pensarci ancora.
dlga_ransom_broker_talk:ransom_broker_intro_2|Ditemi ciò che c'è di nuovo.
dlga_ransom_broker_talk:ransom_broker_ransom_companion|Desidero riscattare uno dei miei compagni.
dlga_ransom_broker_ransom_companion:ransom_broker_ransom_companion_choose|Chi volete riscattare?
dlga_ransom_broker_ransom_companion_choose:ransom_broker_ransom_companion_name_sum|{s4}
dlga_ransom_broker_ransom_companion_choose:ransom_broker_pretalk|Non importa.
dlga_ransom_broker_ransom_companion_name_sum:ransom_broker_ransom_companion_verify|Fatemi controllare il mio libro mastro, ecco... Si. Il vostro amico è imprigionato nei sotterranei di {s7}. Interessante! Ricordo di aver sentito dire che i ratti li sotto sono particolarmente grossi, come mastini, dicono... Ora... Per la veramente modica somma di {reg5} denari, che include sia il prezzo di riscatto che la mia commissione e le spese, possiamo organizzare in modo che {s5} possa nuovamente godere della {reg4?sua:sua} libertà. Che ne dite?
dlga_ransom_broker_ransom_companion_verify:ransom_broker_ransom_companion_accept|Ecco i vostri soldi.
dlga_ransom_broker_ransom_companion_verify:ransom_broker_ransom_companion_refuse|Non posso permettermi questa somma al momento.
dlga_ransom_broker_ransom_companion_accept:ransom_broker_talk|Splendido! Penso che in pochi giorni dovreste trovare {s5} che cavalca per riunirsi a voi,  ammiccando alla luce del sole e senza dubbio molto grato! C'è qualche altro modo in cui posso aiutarvi?
dlga_ransom_broker_ransom_companion_refuse:ransom_broker_talk|Certo, certo... Non importa quello che dicono sui topi, d'altro canto io non ho mai visto uno, a causa del buio nero come la pece. Comunque, sono sicuro che {s5} capirà perché è così importante per voi il controllo delle spese. Ora... C'è qualcos'altro?
dlga_ransom_broker_talk:close_window|Non ora. Arrivederci.
dlga_ransom_broker_sell_prisoners:ransom_broker_sell_prisoners_2|Vediamo cos'avete...
dlga_ransom_broker_sell_prisoners_2:close_window|Resterò qui ancora per alcuni giorni. Fatemi sapere se avrete bisogno dei miei servigi.
dlga_start:tavern_traveler_talk|Salute. Mi sembrate il genere di {uomo/donna} che cerca informazioni. Ho viaggiato molto attraverso tutto il mondo e ho sempre l'orecchio teso. Posso offrirvi informazioni che potrebbero esservi utili... Ovviamente ad un piccolo prezzo.
dlga_start:tavern_traveler_lost_companion_thanks|Salute, {playername}. Ho visto il vostro compagno {s10} in una taverna a {s11} qualche giorno fa. Credo vi possa interessare...
dlga_tavern_traveler_lost_companion_thanks:tavern_traveler_pretalk|Grazie. Andrò e troverò {reg3?quell'uomo:quella donna} in quel luogo.
dlga_tavern_traveler_lost_companion_thanks:tavern_traveler_pretalk.1|Grazie, ma non m'interessa.
dlga_start:tavern_traveler_talk.1|Salute, {playername}.
dlga_tavern_traveler_pretalk:tavern_traveler_talk|Sì?
dlga_tavern_traveler_talk:tavern_traveler_tell_kingdoms|Cosa potete dirmi di queste terre?
; dlga_tavern_traveler_tell_kingdoms:tavern_traveler_tell_kingdoms_2|The free cities of Essos have been trying to eliminate each other since the Bleeding Years, more than three hundred years ago. Until recently, Westeros was ruled by a single king, but with Robert Baratheons death, the seven kingdoms have fragmented, with both his brothers and his son claiming the throne, and Robb Stark fighting for independence. I hear that the Dothraki have been causing trouble in the east, but I seldom travel that far, and either way, the Demon Road, the Ruins of Valyria and the Dothraki Sea make the journey dangerous. Only fools travel that way! Anyhow, at least the current chaos, gripping the world, must present an adventurer such as yourself with quite the opportunities. With some luck and skill, you can make a name for yourself here, amass a fortune perhaps, or gain great power. Opportunities are endless and so are the rewards, if you are willing to risk your life for them.
dlga_tavern_traveler_tell_kingdoms_2:tavern_traveler_tell_kingdoms_3|Parlatemi ancora di queste opportunità.
dlga_tavern_traveler_tell_kingdoms_2:close_window|Grazie. Era tutto quello che volevo sapere.
dlga_tavern_traveler_tell_kingdoms_3:tavern_traveler_tell_kingdoms_4|Bene, credo che sappiate già tutto quello che potrei dirvi. Sembra che ve la stiate cavando molto bene.
dlga_tavern_traveler_tell_kingdoms_3:tavern_traveler_tell_kingdoms_4a|I regni pagano molti denari ai mercenari, se sono in guerra. Se siete abile nel combattimento, ottenendo udienza da uno dei lords potreste guadagnare un ingaggio come Compagnia mercenaria. Comunque le vere ricompense si hanno diventando il vassallo di un Re. Un vassallo può possedere villaggi, castelli e città e può diventare ricco con le tasse e redditi di questi appezzamenti terrieri. Normalmente, soltanto i nobili del reame hanno questa possibilità, ma in tempi di guerra, un Re non esiterà ad accettare qualche {uomo/donna} che lo aiuti sul campo di battaglia come vassallo, dando a {quest'uomo/questa donna} come concessione, il diritto di possedere terreni.
dlga_tavern_traveler_tell_kingdoms_4a:tavern_traveler_tell_kingdoms_4|Non è inaudito per un avventuriero rinunciare alla fedeltà verso un Re, dichiarare di essere lui stesso un monarca e reclamare terre in proprio nome. Questo tuttavia è un percorso difficile, in quanto i nobili di antica ascendenza non sono propensi ad accettare un nuovo arrivato come loro sovrano. Tali governanti debbono muoversi con molta scaltrezza per consolidare il loro diritto a regnare, altrimenti sarebbero minacciati da tutte le parti.
dlga_tavern_traveler_tell_kingdoms_4:tavern_traveler_tell_kingdoms_5|Potrebbe essere più facile, per chi combatte come voi, fornire sostegno al rivale di un Re.  Ci sono molti pretendenti in questo mondo - coloro che sono nati nella famiglia giusta - che vanno in giro ad accendere gli animi dicendo che hanno un diritto maggiore al trono rispetto all'attuale Re. Se questi trovano un numero sufficiente di sostenitori, potrebbero provocare guerre civili e forse un giorno sostituirsi al Re in carica.
dlga_tavern_traveler_tell_kingdoms_5:tavern_traveler_tell_kingdoms_6|Interessante. Dove posso trovare questi che hanno bisogno di supporto?
dlga_tavern_traveler_tell_kingdoms_5:close_window|Credo di aver sentito abbastanza. Grazie.
dlga_tavern_traveler_tell_kingdoms_6:tavern_traveler_pretalk|La vita di un pretendente al trono potrebbe essere in pericolo nel suo stesso paese. Per questo, solitamente, risiedono presso le corti di altri regni in attesa di trovare qualcuno in grado di supportare la loro causa. Normalmente, ricevo delle notizie sulla loro posizione, quindi sono in grado di darvi delle informazioni abbastanza precise a questo proposito. Ma, ovviamente, vi chiederò un piccolo compenso per i miei servigi.
dlga_tavern_traveler_talk:tavern_traveler_pretender_location|Vorrei sapere la posizione di un pretendente.
dlga_tavern_traveler_pretender_location:tavern_traveler_pretender_location_ask|Di chi volete sapere?
dlga_tavern_traveler_pretender_location_ask:tavern_traveler_pretender_location_ask_2|{s11}
dlga_tavern_traveler_pretender_location_ask:tavern_traveler_pretalk|Niente... non importa.
dlga_tavern_traveler_pretender_location_ask_2:tavern_traveler_pretender_location_ask_money|Posso rivelarvi queste informazioni per una piccola somma, diciamo 30 denari.
dlga_tavern_traveler_pretender_location_ask_money:tavern_traveler_pretender_location_tell|Va bene. Ecco 30 denari.
dlga_tavern_traveler_pretender_location_ask_money:tavern_traveler_pretalk|Niente... non importa.
dlga_tavern_traveler_pretender_location_tell:tavern_traveler_pretalk|{s15} è attualmente a {s11}.
dlga_tavern_traveler_talk:tavern_traveler_bookseller_location|Sto cercando un commerciante di libri...
dlga_tavern_traveler_bookseller_location:tavern_traveler_pretalk|Mi dispiace ma non ho visto nessuno ultimamente.
dlga_tavern_traveler_bookseller_location:tavern_traveler_bookseller_location_ask_money|Forse ne ho incrociati uno o due di recente. Per 100 belle monete, vi dirò dove.
dlga_tavern_traveler_bookseller_location_ask_money:tavern_traveler_bookseller_location_tell|Va bene. Ecco 100 monete.
dlga_tavern_traveler_bookseller_location_ask_money:tavern_traveler_pretalk|Niente... non importa.
dlga_tavern_traveler_bookseller_location_tell:tavern_traveler_pretalk|Potrere trovarlo a {s11}.
dlga_tavern_traveler_talk:tavern_traveler_ransom_broker_location|Sto cercando un riscattatore.
dlga_tavern_traveler_ransom_broker_location:tavern_traveler_pretalk|Mi dispiace ma non ho visto nessuno ultimamente.
dlga_tavern_traveler_ransom_broker_location:tavern_traveler_ransom_broker_location_ask_money|Sò dove potete trovarne uno. per 50 monete, ve lo dirò.
dlga_tavern_traveler_ransom_broker_location_ask_money:tavern_traveler_ransom_broker_location_tell|Va bene. Ecco 50 denari.
dlga_tavern_traveler_ransom_broker_location_ask_money:tavern_traveler_pretalk|Niente... non importa.
dlga_tavern_traveler_ransom_broker_location_tell:tavern_traveler_pretalk|Potrere trovarlo a {s11}.
dlga_tavern_traveler_talk:dplmc_tavern_traveler_employee_1|Sto cercando uno dei miei ex dipendenti...
dlga_dplmc_tavern_traveler_employee_1:dplmc_tavern_traveler_employee_2|Forse posso aiutarvi. Chi cercate?
dlga_dplmc_tavern_traveler_employee_2:dplmc_tavern_traveler_employee_3|Il mio ex ciambellano, {s11}.
dlga_dplmc_tavern_traveler_employee_2:dplmc_tavern_traveler_employee_3.1|Il mio ex contabile, {s11}.
dlga_dplmc_tavern_traveler_employee_2:dplmc_tavern_traveler_employee_3.2|Il mio ex cancelliere, {s11}.
dlga_dplmc_tavern_traveler_employee_2:tavern_traveler_pretalk|Niente... non importa.
dlga_dplmc_tavern_traveler_employee_3:tavern_traveler_pretalk|Spargerò la voce che {reg0?la:lo} state cercando.
dlga_dplmc_tavern_traveler_employee_3:tavern_traveler_pretalk.1|Mi dispiace ma non posso aiutarvi.
dlga_tavern_traveler_talk:tavern_traveler_companion_location|Cerco uno dei miei compagni...
dlga_tavern_traveler_companion_location:tavern_traveler_companion_location_ask|Forse posso aiutarvi. Chi cercate?
dlga_tavern_traveler_companion_location_ask:tavern_traveler_companion_location_ask_2|{s11}
dlga_tavern_traveler_companion_location_ask:tavern_traveler_pretalk|Niente... non importa.
dlga_tavern_traveler_companion_location_ask_2:tavern_traveler_companion_location_ask_money|So dove si trova {s15}. Per 30 denari, ve lo dirò.
dlga_tavern_traveler_companion_location_ask_money:tavern_traveler_companion_location_tell|Va bene. Ecco 30 denari.
dlga_tavern_traveler_companion_location_ask_money:tavern_traveler_pretalk|Niente... non importa.
dlga_tavern_traveler_companion_location_tell:tavern_traveler_pretalk|{s15} è attualmente a {s11}.{s12}
dlga_tavern_traveler_talk:close_window|Addio.
dlga_start:tavern_traveler_answer|Salute. Sembrate il tipo di {uomo/donna} che potrebbe essere interessato a sentire le informazioni che ho raccolto durante i miei viaggi a {s17}. Vi dirò tutto quello che so in cambio di 100 denari.
dlga_tavern_traveler_answer:tavern_traveler_continue|Ecco 100 denari. Ditemi quello che sapete.
dlga_tavern_traveler_answer:close_window|Mi spiace amico. Non m'interessa.
dlga_tavern_traveler_continue:close_window|Bene, è tutto. Arrivederci.
dlga_start:bookseller_talk|Buongiorno, volete consultare i miei libri?
dlga_bookseller_talk:bookseller_buy|Sì. Mostratemi cos'avete in vendita.
dlga_bookseller_buy:book_trade_completed|Certo.
dlga_book_trade_completed:bookseller_talk|Nient'altro?
dlga_bookseller_talk:close_window|Niente. Grazie.
; dlga_start:mystic_merchant_talk|Good day my friend, I have some unidentified items with me. I will sell these items to you by the base price of them. You probably buy an item with a good prefix by a low price or buy an item with a bad prefix by a hight price. Do you want to try your fortune?
dlga_mystic_merchant_talk:mystic_merchant_type|Ottima idea. voglio fare una prova.
dlga_mystic_merchant_type:mystic_merchant_type_sel|Quale tipo volete controllare?
