dlga_start:lco_conversation_end|Eccoti qua.
dlga_start:close_window.1|...
dlga_start:close_window.2|Sto provando a suonare qui!
dlga_award_fief_to_vassal:award_fief_to_vassal_defer|Desidero rimandare la nomina di un lord fino a quando non potrò avere il consiglio dei miei sudditi.
dlga_award_fief_to_vassal_defer:close_window|Come volete, {sire/mia signora}. Potrete decidere sulla questione in un secondo momento.
dlga_award_fief_to_vassal_2:close_window|Come desiderate, {sire/mia signora}.
dlga_event_triggered:center_captured_rebellion|{s1} non è controllato da nessuno. A chi darlo in custodia?
dlga_center_captured_rebellion:center_captured_rebellion_2|{s11}. {s1}
dlga_center_captured_rebellion:center_captured_rebellion_2.1|{reg0?{s65}:Vi prego {s65}}, vorrei tenere {s1} per me. (feudi: {s0})
dlga_center_captured_rebellion:center_captured_rebellion_2.2|{s66}, potreste avere in custodia {s1}. (feudi: {s0})
dlga_center_captured_rebellion:center_captured_rebellion_2_defer|Sarebbe meglio non nominare ancora nessuno, e decidere in seguito.
dlga_center_captured_rebellion_2_defer:close_window|Hmmm. Va bene, {playername}. Apprezzo il vivamente il suo consiglio. Rinvierò la nomina del Lord di {s1} per il momento.
dlga_center_captured_rebellion_2:close_window|Hmmm. Così sia, {playername}. Ho valutato il vostro consiglio. {reg6?Io sarò:{reg7?Voi sarete:{s11}}} {reg3?la nuova signora:il nuovo signore} di {s1}.
dlga_start:fighter_talk|Benvenuto! Noi qui stiamo affinando le nostre abilità di combattimento facendo un po' d'addestramento. Sembrate qualcuno che ha bisogno di far pratica nell'arte della guerra. Perché non vi unite a noi? Potremmo mostrarvi alcuni trucchi. E se avete bisogno di qualche spiegazione sui concetti del combattimento, basta chiedere e farò del mio meglio per accontentarvi.
dlga_start:fighter_talk.1|In cosa volete fare pratica?
dlga_fighter_pretalk:fighter_talk|Ditemi, in cosa volete addestrarvi?
dlga_fighter_talk:fighter_talk_train_attack|Voglio addestrarmi nelle tecniche d'attacco.
dlga_fighter_talk:fighter_talk_train_parry|Voglio addestrarmi nelle parate con l'arma bianca.
dlga_fighter_talk:fighter_talk_train_combat|Voglio fare un po' di pratica di combattimento.
dlga_fighter_talk:close_window|[Lascia]
dlga_fighter_talk_train_attack:fighter_talk_train_attack_2|Bene. Ci sono quattro principali direzioni d'attacco. Queste sono: fendente (dall'alto), dritto (da destra), verso (da sinistra) e stoccata (di punta). Ora vi dirò da quale direzione attaccare e poi dovrete provare a fare il giusto tipo d'attacco.  ^^(Muovi il mouse mentre premi il bottone sinistro per specificare la direzione d'attacco. Per esempio, per eseguire un fendente, muovi il mouse in avanti e nello stesso tempo premi il bottone sinistro. Le icone sullo schermo ti aiuteranno a fare il movimento corretto.)
dlga_fighter_talk_train_attack_2:close_window|Cominciamo allora. Posso iniziare.
dlga_fighter_talk_train_attack_2:fighter_pretalk|Adesso voglio fare qualcos'altro.
dlga_fighter_talk_train_parry:fighter_talk_train_parry_2|Senza uno scudo, difendendovi con un'arma potete fermare gli attacchi che vengono solo da una direzione. Per esempio se difendete verso l'alto, parerete solo i fendenti, ma potreste essere colpito ai fianchi o frontalmente. ^^(Devi cliccare e tenere premuto il tasto destro del mouse per parare.)
dlga_fighter_talk_train_parry_2:fighter_talk_train_parry_3|Quando vi metterete nella corretta posizione di difesa, vi attaccherò con diversi tipi d'attacco. Provate ad eseguire la parata corretta il più velocemente possibile. ^^(Questo esercizio è facile con il controllo dir. parata regolato su 'automatico' nelle opzioni di base. Se apri il menu Opzioni e cambi il controllo della direzione di parata su 'in base al movimento del mouse' o 'dalla tastiera', dovrai scegliere manualmente la direzione della parata. Ciò è certamente più difficile, ma rende il gioco più interessante. È un esercizio molto utile se usi il blocco manuale.)
dlga_fighter_talk_train_parry_3:close_window|Cominciamo allora. Posso iniziare.
dlga_fighter_talk_train_parry_3:fighter_pretalk|Adesso voglio fare qualcos'altro.
dlga_fighter_talk_train_combat:fighter_talk_train_combat_2|Lo scontro è un ottimo modo per prepararsi al combattimento reale. Combatteremo tra noi con armi non letali, fino a quando uno dei due cade a terra. Potete farvi qualche livido, ma è sempre meglio che avere la peggio in uno scontro reale.
dlga_fighter_talk_train_combat_2:close_window|Cominciamo allora. Posso iniziare.
dlga_fighter_talk_train_combat_2:fighter_pretalk|Adesso voglio fare qualcos'altro.
dlga_start:fighter_parry_try_again|Bene. Avete mostrato abilità nel bloccare i miei attacchi. Dovete ripetere quest'addestramento e provare a diventare sempre più veloce, fino a quando non acquisirete confidenza con le vostre abiltà difensive. Volete addestrarvi ancora?
dlga_start:fighter_parry_try_again.1|Non è andata molto bene, concordate? Volete provare di nuovo? (Ricorda, devi cliccare e tenere premuto il tasto destro del mouse per rendere la parata effettiva.)
dlga_fighter_parry_try_again:fighter_talk_train_parry|Si. Proviamo di nuovo.
dlga_fighter_parry_try_again:fighter_talk_leave_parry|No, penso che sia tutto per ora.
dlga_start:fighter_parry_warn|Hey! Stiamo facendo pratica di difesa, amico! Si presume che pariate i miei attacchi, non che rispondiate attaccandomi.
dlga_fighter_parry_warn:fighter_talk_train_parry|Scusatemi. Proviamo di nuovo.
dlga_fighter_parry_warn:fighter_talk_leave_parry|Spiacente. Devo abbandonare la pratica ora.
dlga_fighter_talk_leave_parry:close_window|Bene. Come desiderate.
dlga_start:fighter_combat_try_again|Non è andata molto bene, concordate? Non preoccupatevi, e provate a non commettere gli stessi errori la prossima volta. Volete continuare ad addestrarvi?
dlga_fighter_combat_try_again:fighter_talk_train_combat|Sì. Facciamo un altro scontro.
dlga_fighter_combat_try_again:fighter_talk_leave_combat|No. È abbastanza per me.
dlga_fighter_talk_leave_combat:close_window|Va bene. Tornate da me se cambiate idea.
dlga_start:fighter_combat_try_again.1|Hey, è stato uno scontro valido. Mi avete sconfitto, la prossima volta però farò più attenzione. Volete fare un altro giro?
dlga_start:fighter_talk.2|Molto bene. Avete imparato come attaccare da qualunque direzione vogliate. Se lo desiderate possiamo provare di nuovo o passare ad un altro esercizio.
dlga_start:archer_challenge_2|Non male. Non male veramente! Sembra che abbiate afferrato le basi del tiro con l'arco. Ora, provate a fare lo stesso con la balestra. Prendete la balestra e i dardi là sopra e colpite quei tre bersagli. La balestra è molto facile da usare rispetto all'arco, ma richiede più tempo per essere ricaricata.
dlga_start:archer_challenge_2.1|Bene. Non avete avuto difficoltà nemmeno usando la balestra. Adesso imparerete ad usare le armi da lancio. Raccogliete i giavellotti che vedete laggiù e provate a colpire quei tre bersagli.
dlga_start:ranged_end|Bene, con questo avete ricevuto le istruzioni di base per usare tutte e tre le armi a distanza. Il resto verrà con la pratica. Allenatevi ogni giorno, e col tempo potreste superare i tiratori di tutta Calradia.
dlga_ranged_end:close_window|Ora potete andare a parlare con i combattenti di mischia o con il maestro dei cavalieri, se non l'avete già fatto. Anche loro possono farvi migliorare su alcune importanti abilità.
dlga_start:archer_talk|Buongiorno, giovane. Trascorro il mio tempo ad insegnare tutto sulle armi da tiro a chiunque voglia imparare. Se avete bisogno di un tutore, fatemelo sapere e v'insegnerò come usare l'arco, la balestra e il giavelotto.
dlga_archer_talk:archer_challenge|Si, mostratemi come usare le armi da lancio.
dlga_archer_talk:close_window|No, non ora.
dlga_archer_challenge:archer_challenge_2|D'accordo. Il vostro primo addestramento consisterà nel tiro con l'arco. L'arco è un'arma difficile da padroneggiare. Ma se siete anche appena capace, potrete tirare velocemente e con grande potenza. Andate a raccogliere l'arco e le frecce che vedete là sopra e colpite quei bersagli.
dlga_archer_challenge_2:close_window|Va bene. Posso iniziare.
dlga_archer_challenge_2:close_window.1|Aspettate un attimo. Voglio fare qualcos'altro prima.
dlga_start:horseman_melee_challenge_2|Spero che vi piaccia cavalcare. Ora passiamo a qualcosa di un po' più difficile. Afferrate la lancia che vedete là sopra e cavalcate lungo il percorso colpendo i bersagli allo stesso tempo.
dlga_start:horseman_melee_challenge_2.1|Ottimo! Avete colpito tutti i bersagli da cavallo. Non è una cosa facile per una persona alle prime armi. La vostra prossima sfida sarà quella di usare arco e frecce per colpire i bersagli lungo il percorso. Occorre che usiate una freccia su ciascun bersaglio per considerare superata la prova.
dlga_start:horsemanship_end|Molto bene. Avete colpito tutti i bersagli da cavallo. Continuate a cavalcare e a far pratica ogni giorno, in breve tempo diverrete una persona esperta.
dlga_horsemanship_end:close_window|Ora, potete andare a parlare con i combattenti di mischia o con il maestro degli arcieri, se non l'avete già fatto. Avete bisogno d'imparare tutto il possibile per quando dovrete difendervi.
dlga_start:horseman_talk|Buongiorno. Sono arrivato qui per fare della pratica d'equitazione, ma le mie vecchie ossa sono doloranti, così ho deciso per oggi di riposarmi. Se volete migliorare le vostre capacità nel cavalcare, potete prendere il mio cavallo. L'esercizio farà bene anche a lui.
dlga_horseman_talk:horseman_challenge|Si, voglio fare pratica d'equitazione.
dlga_horseman_talk:close_window|Uhm. Forse dopo.
dlga_horseman_challenge:horseman_melee_challenge_2|Bene. Ora farete qualche esercizio che v'insegnerà a cavalcare e ad usare armi a cavallo. Il vostro primo compito è semplice. Prendete il cavallo per un giro intorno al circuito. Andate lentamente o velocemente, come preferite. Tornate quando avrete preso confidenza con l'uso del cavallo e vi darò altri esercizi da fare.
dlga_horseman_melee_challenge_2:close_window|Va bene. Posso iniziare.
dlga_horseman_melee_challenge_2:close_window.1|Aspettate un attimo. Devo fare qualcos'altro prima.
dlga_tutorial_troop_default:close_window|Hey, sto facendo pratica qui! Andate, parlate con il maestro arciere se volete avere informazioni sulle armi da lancio...
dlga_start:lord_prison_break_confirm_3|C'è un cambiamento nei piani?
dlga_start:lord_prison_break|Che sta succedendo?
dlga_start:drunk_response|Che state guardando?
dlga_start:drunk_response.1|State guardando me?
dlga_player_duel_response:close_window|Un tale spreco...
dlga_player_duel_response:close_window.1|Meglio lui che me
dlga_drunk_response:drunk_fight_start|Non so con certezza... Qualche tipo di animale, decisamente.
dlga_drunk_response:dplmc_drunk_attempt_placate|Mi scusi -- per favore accettate le mie scuse
dlga_dplmc_drunk_attempt_placate:close_window|Lascio stare ... per questa volta. Ora andate via.
dlga_dplmc_drunk_attempt_placate:close_window.1|Cancellerò quel sorriso dalla vostra faccia!
dlga_drunk_fight_start:close_window|Cancellerò quel sorriso dalla vostra faccia!
dlga_drunk_response:drunk_player_high_renown|Avete idea di chi io sia?
dlga_drunk_player_high_renown:drunk_fight_start|Mi dovrebbe importare?
dlga_drunk_player_high_renown:drunk_fight_start.1|Perché... Se volete uno scontro, l'avrete!
dlga_drunk_player_high_renown:drunk_player_high_renown|Emh... Veramente si, si... So chi siete, {s0}. Vi prego di perdonarmi, Vostra Grazia... È colpa dell'alcool. Me ne sto andando, ora...
dlga_drunk_player_high_renown:drunk_fight_start.2|Bene, se cercate uno scontro, lo avrete!
dlga_drunk_player_high_renown:close_window|Ci ho ripensato. Ora toglietevi dai piedi!
dlga_start:fistfight_response|Mi sembrate {un ragazzo/una ragazza} che può sopportare qualche colpo duro, e anche restituirne. Ho una proposta d'affari per voi.
dlga_fistfight_response:fistfight_response_2|Di che si tratta?
dlga_fistfight_response_2:fistfight_response_2a|Bene, sono contento che v'interessi. Ecco il piano... È un po' complicato, quindi ascoltate attentamente...
dlga_fistfight_response_2a:fistfight_response_3|Voi e quest'altro ragazzo inizierete un combattimento qui. Niente armi nè armatura. Io starò seduto qui e prenderò le scommesse, e dividerò i profitti con il vincente. Se ci rimetteremo, allora coprirò la perdita. Voi non avrete nulla da perdere... Tranne un po' di sangue, ovvimente.
dlga_fistfight_response_3:fistfight_response_4|Tuttavia, non possiamo organizzare tutto questo come nelle arene dove le persone possono piazzare le loro scommesse in anticipo. Le persone entreranno attratte dal rumore, e punteranno uno o due denari su chi tra voi due riterranno possa essere il vincente. Io darò le quote... Sarà difficile ragionare per qualcuno che è già alla sua terza bottiglia di birra.
dlga_fistfight_response_4:fistfight_response_4a|Quindi, come potete capire, il trucco è di far durare la cosa il più a lungo possibile, far sembrare che stiate perdendo, in modo che la gente scommetta contro di voi... E poi riprendersi velocemente e vincere, prima che le scommesse cambino senso. Il modo migliore per voi di far soldi è di soccombere fino a cadere sul pavimento, e a quel punto rimettersi in piedi e buttare giù l'altro ragazzo. La cosa importante è che alla fine voi vinciate in modo che sia io che voi possiamo procuraci un bel po' di soldi.
dlga_fistfight_response_4a:fistfight_response_5|Inoltre non è possibile tirarla troppo per le lunghe, perché la gente potrebbe sospettare una truffa. Così uno di voi ogni tanto deve prendere un pugno in faccia. Non m'interessa di chi sarà il sangue versato, ma il sangue deve scorrere.
dlga_fistfight_response_5:fistfight_response_5a|E un altra cosa... Il mio compagno, il vostro avversario, non è di certo particolarmente bravo nel gioco di gambe. Quindi vi attaccherà direttamente, a testa bassa. Toccherà a voi fare un po' di scena.
dlga_fistfight_response_5a:fistfight_response_confirm|Allora, che ne pensate?
dlga_fistfight_response_confirm:close_window.1|Ho cose migliori da fare.
dlga_start:ramun_introduce_1|Buongiorno a voi, {giovanotto/ragazzina}.
dlga_ramun_introduce_1:ramun_introduce_2|Perdonatemi, sembrate un mercante, ma non vedo nessuna mercanzia.
dlga_ramun_introduce_1:close_window|Niente... non importa.
dlga_ramun_introduce_2:ramun_introduce_3|Un Mercante? Oh, certo, io lo sono di sicuro. La mia mercanzia è differente da quella comune, comunque. Dev'essere alimentata e abbeverata due volte al giorno e cerca di scappare se gli volgo la schiena.
dlga_ramun_introduce_3:ramun_introduce_4|Merce viva?
dlga_ramun_introduce_4:ramun_introduce_5|Non siete distante dal vero. Mi piace chiamarmi 'l'uomo che tiene ogni barca su questo oceano in movimento'. Le barche sono guidate da remi, come sapete, ed i remi hanno bisogno di uomini per muoverle o arrestarle. Ecco dove arrivo io.
dlga_ramun_introduce_5:ramun_introduce_6|Schiavi per galee...
dlga_ramun_introduce_6:ramun_introduce_7|Ecco! Un porto commerciale non può sopravvivere senza di loro. Le galee perdono molte braccia in ogni viaggio, così c'è sempre un'alta richiesta. I capitani vengono da me e mi pagano bene.
dlga_ramun_introduce_7:ramun_introduce_8|Da dove vengono gli schiavi?
dlga_ramun_introduce_8:ramun_introduce_9|La maggior parte sono criminali presi dalle autorità. Altri sono prigionieri di guerra di varie nazioni, portati da me perché faccio i prezzi migliori. Comunque, alcune volte compro dai privati e da altri... 'singoli affaristi indipendenti'... Non si può essere schizzinosi in questo tipo di lavoro. Avete per caso dei prigionieri al seguito?
dlga_ramun_introduce_9:ramun_introduce_10|Io?
dlga_ramun_introduce_10:ramun_introduce_11|Perché no? Se vi troverete fuori dalla città, incrocerete la spada con qualcuno prima o poi. E, se Dio vuole, li batterete. perché non fare qualche soldo extra? Prendeteli vivi, portateli da me, e vi pagherò 55 denari per ogni testa. Non preoccupatevi troppo di chi siano e da dove vengano.
dlga_ramun_introduce_11:ramun_introduce_12|Hmm. Ci Penserò.
dlga_ramun_introduce_12:close_window|Pensateci! Ci sono un sacco di soldi da fare, senza fallo. Molti! Sia per me che per voi.
dlga_start:ramun_talk|Salve, {playername}.
dlga_ramun_pre_talk:ramun_talk|Nient'altro?
dlga_ramun_talk:ramun_sell_prisoners|Vi ho portato qualche prigioniero, Ramun. Ve ne volete prendere cura?
dlga_ramun_talk:ramun_sell_prisoners_all|Voglio vendere tutti i prigionieri che ho con me.
dlga_ramun_sell_prisoners_all:ramun_sell_prisoners_all_2|Prenderò i tuoi {reg0} {reg2?prigionieri:prigioniero} per {reg1} monete. Daccordo?
dlga_ramun_sell_prisoners_all_2:ramun_sell_prisoners_2|Abbiamo un accordo.
dlga_ramun_sell_prisoners_all_2:ramun_pre_talk|Lasciami pensarci ancora.
dlga_ramun_sell_prisoners:ramun_sell_prisoners_2|Vediamo cos'avete...
dlga_ramun_sell_prisoners_2:close_window|È un piacere fare affari con Vostra Signoria.
dlga_ramun_talk:ramun_ask_about_capturing|Come posso prendere prigionieri?
dlga_ramun_talk:ramun_ask_about_capturing.1|Mi potete dire come catturare alcuni prigionieri?
dlga_ramun_ask_about_capturing:ramun_have_blunt_weapon|Siete alle prime armi in questo, non è vero? Lasciatemi spiegare in parole brevi. La regola basilare è che per prendere prigionieri bisogna stordire i nemici con armi come una mazza o una clava, invece di aprirli in due con una spada. Così sverranno per un po' piuttosto che morire dissanguati, non credete? Sicuramente avrete un'arma adatta alla bisogna...
dlga_ramun_have_blunt_weapon:ramun_have_blunt_weapon_yes|Certo.
dlga_ramun_have_blunt_weapon:ramun_have_blunt_weapon_no|Purtroppo no...
dlga_ramun_have_blunt_weapon_yes:ramun_ask_about_capturing_2|Bene, in termini più crudi l'unica cosa da fare è schiacciare questi insetti, e quando la battaglia è vinta potrete metterli in manette. È leggermente differente per nobili e comandanti: grazie alla loro abilità e alla pesante protezione che indossano rimarranno in vita anche se li colpirete con armi perforanti o da taglio.
dlga_ramun_have_blunt_weapon_no:ramun_have_blunt_weapon_no_2|No? Heh, bene, questo potrebbe essere il vostro giorno fortunato. Ho solo una vecchia clava che stavo per gettare via. È un po' rovinata, ma è ancora buona per colpire qualcuno finchè non sviene. Ecco, prendete.
dlga_ramun_have_blunt_weapon_no_2:ramun_have_blunt_weapon_yes|Grazie, Ramun. La metterò alla prova.
dlga_ramun_ask_about_capturing:ramun_ask_about_capturing_2|Bene, Lasciate che vi spieghi in parole brevi. La regola basilare è che per prendere prigionieri bisogna stordire i nemici con armi come una mazza o una clava, invece di aprirli in due con una spada. Così sverranno per un po' piuttosto che morire dissanguati, non credete? È leggermente differente per nobili e comandanti: grazie alla loro abilità e alla pesante protezione che indossano rimarranno in vita anche se li colpirete con armi perforanti o da taglio.
dlga_ramun_ask_about_capturing_2:ramun_ask_about_capturing_3|Ok, penso di aver capito. Qualcos'altro?
dlga_ramun_ask_about_capturing_3:ramun_ask_about_capturing_4|Beh, tenete conto che non è una cosa semplice da fare. Le armi contundenti non fanno gli stessi danni di quelle taglienti, così non tireranno giù i nemici con la stessa velocità. E fidatevi, molte carogne che incontrerete vorranno uccidervi appena vi vedranno, quindi non aspettatevi alcuna cortesia particolare estraendo una clava anzichè una spada. Oltretutto, avendo dei prigionieri con voi, rallenterete il vostro viaggiare, ecco perché alcuni liberano i prigionieri dopo che la battaglia ha avuto termine. È follia! Come può una persona gettare tutto quel denaro, eh?
dlga_ramun_ask_about_capturing_4:ramun_ask_about_capturing_5|Questo è tutto?
dlga_ramun_ask_about_capturing_5:ramun_ask_about_capturing_7|Giusto un'ultima cosa. Controllare i prigionieri con sicurezza non è una cosa semplice da fare, si può dire che è una capacità a sè stante. Se volete catturare molti prigionieri, dovete provare ed imparare per conto vostro, o non potrete portare nemmeno un uomo presso di voi.
dlga_ramun_ask_about_capturing_7:ramun_pre_talk|Grazie, lo terrò a mente.
dlga_ramun_talk:ramun_leave|È meglio che vada.
dlga_ramun_leave:close_window|Ricordate, ogni prigioniero che avete, portatelo da me. Vi pagherò per ognuno di loro.
dlga_start:close_window.5|Chiedo umilmente a vostra signoria di tenere le sue mani dove possa vederle.
dlga_start:manhunter_talk_b|Hey, voi! Avete visto dei criminali qui intorno?
dlga_manhunter_talk_b:manhunter_talk_b1|Si, sono passati circa un'ora fa.
dlga_manhunter_talk_b1:close_window|Lo sapevo! Andiamo ragazzi, prendiamo questi cani! Grazie mille.
dlga_manhunter_talk_b:manhunter_talk_b2|No, non ho visto alcun criminale.
dlga_manhunter_talk_b2:close_window|Bah. Si sono nascosti come topi in questa regione, ma con il fumo li tireremo fuori. Prima o poi.
dlga_looters_1:looters_2|{s4}
dlga_looters_2:close_window|Non ho paura di voi. Combattete se non avete timore!
dlga_looters_2:close_window.1|Non avrete niente da me a parte del freddo metallo, feccia!
dlga_start:smugglers_intro_1|Buona giornata a voi.
dlga_smugglers_intro_1:smugglers_intro_2|Ho sentito che avete causato problemi a {s1}. Datemi una buona ragione per cui non dovrei uccidervi tutti.
dlga_smugglers_intro_2:smugglers_intro_3|Ci siamo nascosti a {s1}, si, ma solo perché avevamo bisogno di un posto dove stare. E forse non ci siamo comportati in maniera corretta. Siamo stati guidati fuori da {s6} dalle sentinelle, in una delle loro periodiche epurazioni, e abbiamo tenuto un basso profilo finché le acque si sono calmate.  Ci stiamo dirigendo di nuovo lì adesso, e non avremo problemi con i contadini di {s1} un'altra volta. Se ci lascerete andare, noi vi daremo una pregiata bottiglia di vino Arbor, che i mercanti riservano a quelli di buona famiglia, e che non vedrete mai in un negozio o in una taverna.
dlga_smugglers_intro_2:smugglers_intro_3a|Ci siamo nascosti a {s1}, si, ma solo perché avevamo bisogno di un posto dove stare. E forse non ci siamo comportati in maniera corretta. Siamo stati guidati fuori da {s6} dalle sentinelle, in una delle loro periodiche epurazioni, e abbiamo tenuto un basso profilo finché le acque si sono calmate.  Ci stiamo dirigendo di nuovo lì adesso, e non avremo problemi con i contadini di {s1} un'altra volta. Se ci lascerete andare, noi vi daremo 250 monete.
dlga_smugglers_intro_3:smugglers_go_back|Pensi che mi sarei fatto corrompere!
dlga_smugglers_intro_3:smugglers_let_go|Bene, forse avete ragione. Tutto bene allora. Se qualcuno chiede, io non vi ho visti.
dlga_smugglers_intro_3a:smugglers_go_back|Pensi che mi sarei fatto corrompere!
dlga_smugglers_intro_3a:smugglers_let_go_a|Bene, forse avete ragione. Tutto bene allora. Se qualcuno chiede, io non vi ho visti.
dlga_smugglers_go_back:close_window|Bha, facciamo a modo tuo!
dlga_smugglers_let_go:close_window|Che gli Dei ti benedicano, {playername}. Non dimenticheremo il vostro aiuto. Ecco il vino, attenzione è roba forte!
dlga_smugglers_let_go_a:close_window|Che gli Dei ti benedicano, {playername}. Non dimenticheremo il vostro aiuto. Ecco il denaro.
dlga_start:close_window.6|Buona giornata! Non vi preoccupate. Se qualcuno chiede, noi non l'abbiamo vista.
dlga_start:cheese_rustlers_intro_1|Ben incontrato. Posso aiutarti con qualcosa? Desiderate comprare del grano?
dlga_cheese_rustlers_intro_1:cheese_rustlers_intro_2|Mi hanno incaricato di dare la caccia ad alcuni ladri di grano, voi corrispondete alla descrizione.
dlga_cheese_rustlers_intro_2:cheese_rustlers_intro_3|Grano? Non abbiamo bisogno di alcun grano! Vi sembriamo forse dei ladri?
dlga_cheese_rustlers_intro_3:cheese_rustlers_intro_4|Bene, non mentite...confessate, cos è quel sacco di tela che avete nelle mani?
dlga_cheese_rustlers_intro_4:cheese_rustlers_intro_5|Che diavolo volete dire?
dlga_cheese_rustlers_intro_5:cheese_rustlers_intro_6|Sambra proprio uno di quei sacchi che viene utilizzato per il trasporto di grandi quantità di grano...
dlga_cheese_rustlers_intro_6:close_window|Accidenti! Uccidi{lo/la}! All'attacco!
dlga_start:cheese_paladins_intro_1|Salve, posso aitarvi con qualcosa? Non volete acquistare del vino per caso?
dlga_cheese_paladins_intro_1:cheese_paladins_intro_2|Aspetta, tu sei.....sei un mercenario? Sto dando la caccia ad alcuni ladri...
dlga_cheese_paladins_intro_2:cheese_paladins_intro_3|Ah! Beh, mi dispiace dirlo questi tempi sono duri, con tutti questi problemi e conflitti ultimamente. Ci è venuto in mente che un piccolo gruppo di, diciamo .... uomini esperti, avrebbe attirato meno l'attenzione che i vostri teppisti e fannulloni. Quando questa occasione si è presentata, beh, rifiutare sarebbe stato decisamente folle.
dlga_cheese_paladins_intro_3:close_window|Non preoccupatevi, non ho problemi con voi.
dlga_cheese_paladins_intro_3:cheese_paladins_intro_4|Avrò la vostra testa. Preparatevi a combattere!
dlga_cheese_paladins_intro_4:close_window|Il piacere è tutto nostro. Uomini, a me!
dlga_start:bandits_awaiting_ransom2_intro_1|Siete voi a portare il riscatto? Forza, dateci i soldi adesso!
dlga_start:bandits_awaiting_ransom2_intro_1.1|Siete di ritorno? Avete agito con rapidità, dateci i soldi adesso!
dlga_bandits_awaiting_ransom2_intro_1:bandits_awaiting_ransom2_pay|Ecco, prendete i soldi. Solo lasciate libera la ragazza.
dlga_bandits_awaiting_ransom2_pay:close_window|Heh. Avete portato la somma esatta. Ora potete prendervi la ragazza. Ci siamo divertiti abbastanza con lei. È stato un piacere fare affari con voi...
